[{"id":"ammonium-nitrate","name":"Ammonium Nitrate","formula":"H4N2O3","smiles":"[NH4+].[N+](=O)([O-])[O-]","category":"explosives","priority":2,"tags":["explosive","salt"],"warn":true,"inchi":"","heavy":["N","N","O","O","O"],"bonds":[[1,2,2],[1,3,1],[1,4,1],[0,3,1]],"charges":[[0,1],[1,1],[3,-1],[4,-1]],"explicitH":[[0,4]],"ionicBonds":[[0,3]]},{"id":"potassium-nitrate","name":"Potassium Nitrate","formula":"KNO3","smiles":"[K+].[N+](=O)([O-])[O-]","category":"explosives","priority":2,"tags":["salt"],"warn":true,"inchi":"","heavy":["K","N","O","O","O"],"bonds":[[1,2,2],[1,3,1],[1,4,1],[0,3,1]],"charges":[[0,1],[1,1],[3,-1],[4,-1]],"ionicBonds":[[0,3]]},{"id":"sulfur-s8","name":"Sulfur (S8)","formula":"S8","smiles":"S1SSSSSSS1","category":"explosives","priority":3,"tags":["ring"],"warn":true,"inchi":""},{"id":"nitroglycerin","name":"Nitroglycerin","formula":"C3H5N3O9","smiles":"C(C(CO[N+](=O)[O-])O[N+](=O)[O-])O[N+](=O)[O-]","category":"explosives","priority":4,"tags":["explosive"],"warn":true,"inchi":"","heavy":["C","C","C","O","O","O","N","N","N","O","O","O","O","O","O"],"bonds":[[0,1,1],[1,2,1],[0,3,1],[1,4,1],[2,5,1],[3,6,1],[4,7,1],[5,8,1],[6,9,2],[6,10,1],[7,11,2],[7,12,1],[8,13,2],[8,14,1]],"charges":[[6,1],[7,1],[8,1],[10,-1],[12,-1],[14,-1]]},{"id":"tnt","name":"TNT","formula":"C7H5N3O6","smiles":"CC1=C(C=C(C=C1[N+](=O)[O-])[N+](=O)[O-])[N+](=O)[O-]","category":"explosives","priority":4,"tags":["explosive","aromatic"],"warn":true,"inchi":"","heavy":["C","C","C","C","C","C","C","N","O","O","N","O","O","N","O","O"],"bonds":[[0,1,4],[1,2,4],[2,3,4],[3,4,4],[4,5,4],[5,0,4],[0,6,1],[1,7,1],[7,8,2],[7,9,1],[3,10,1],[10,11,2],[10,12,1],[5,13,1],[13,14,2],[13,15,1]],"charges":[[7,1],[9,-1],[10,1],[12,-1],[13,1],[15,-1]]},{"id":"rdx","name":"RDX","formula":"C3H6N6O6","smiles":"C1N(CN(CN1[N+](=O)[O-])[N+](=O)[O-])[N+](=O)[O-]","category":"explosives","priority":4,"tags":["explosive","ring"],"warn":true,"inchi":"","heavy":["C","N","C","N","C","N","N","O","O","N","O","O","N","O","O"],"bonds":[[0,1,1],[1,2,1],[2,3,1],[3,4,1],[4,5,1],[5,0,1],[1,6,1],[6,7,2],[6,8,1],[3,9,1],[9,10,2],[9,11,1],[5,12,1],[12,13,2],[12,14,1]],"charges":[[6,1],[8,-1],[9,1],[11,-1],[12,1],[14,-1]]},{"id":"tatp","name":"TATP","formula":"C9H18O6","smiles":"CC1(C)OOC(C)(C)OOC(C)(C)O1","category":"explosives","priority":4,"tags":["explosive","ring"],"warn":true,"inchi":"","heavy":["C","O","O","C","O","O","C","O","O","C","C","C","C","C","C"],"bonds":[[0,1,1],[1,2,1],[2,3,1],[3,4,1],[4,5,1],[5,6,1],[6,7,1],[7,8,1],[8,0,1],[0,9,1],[0,10,1],[3,11,1],[3,12,1],[6,13,1],[6,14,1]]},{"id":"picric-acid","name":"Picric Acid","formula":"C6H3N3O7","smiles":"OC1=C(C=C(C=C1[N+](=O)[O-])[N+](=O)[O-])[N+](=O)[O-]","category":"explosives","priority":4,"tags":["explosive","aromatic","acid"],"warn":true,"inchi":"","heavy":["C","C","C","C","C","C","O","N","O","O","N","O","O","N","O","O"],"bonds":[[0,1,4],[1,2,4],[2,3,4],[3,4,4],[4,5,4],[5,0,4],[0,6,1],[1,7,1],[7,8,2],[7,9,1],[3,10,1],[10,11,2],[10,12,1],[5,13,1],[13,14,2],[13,15,1]],"charges":[[7,1],[9,-1],[10,1],[12,-1],[13,1],[15,-1]]},{"id":"petn","name":"PETN","formula":"C5H8N4O12","smiles":"C(C(CO[N+](=O)[O-])(CO[N+](=O)[O-])CO[N+](=O)[O-])O[N+](=O)[O-]","category":"explosives","priority":5,"tags":["explosive"],"warn":true,"inchi":"","heavy":["C","C","C","C","C","O","O","O","O","N","N","N","N","O","O","O","O","O","O","O","O"],"bonds":[[0,1,1],[0,2,1],[0,3,1],[0,4,1],[1,5,1],[2,6,1],[3,7,1],[4,8,1],[5,9,1],[6,10,1],[7,11,1],[8,12,1],[9,13,2],[9,14,1],[10,15,2],[10,16,1],[11,17,2],[11,18,1],[12,19,2],[12,20,1]],"charges":[[9,1],[10,1],[11,1],[12,1],[14,-1],[16,-1],[18,-1],[20,-1]]},{"id":"hmx","name":"HMX","formula":"C4H8N8O8","smiles":"C1N(CN(CN(CN1[N+](=O)[O-])[N+](=O)[O-])[N+](=O)[O-])[N+](=O)[O-]","category":"explosives","priority":5,"tags":["explosive","ring"],"warn":true,"inchi":"","heavy":["C","N","C","N","C","N","C","N","N","O","O","N","O","O","N","O","O","N","O","O"],"bonds":[[0,1,1],[1,2,1],[2,3,1],[3,4,1],[4,5,1],[5,6,1],[6,7,1],[7,0,1],[1,8,1],[8,9,2],[8,10,1],[3,11,1],[11,12,2],[11,13,1],[5,14,1],[14,15,2],[14,16,1],[7,17,1],[17,18,2],[17,19,1]],"charges":[[8,1],[10,-1],[11,1],[13,-1],[14,1],[16,-1],[17,1],[19,-1]]}]
