[{"id":"glycine","name":"Glycine","formula":"C2H5NO2","smiles":"NCC(=O)O","category":"amino","priority":2,"tags":["amino","biomolecule"],"warn":false,"inchi":""},{"id":"alanine","name":"Alanine","formula":"C3H7NO2","smiles":"CC(N)C(O)=O","category":"amino","priority":2,"tags":["amino","biomolecule"],"warn":false,"inchi":"","heavy":["N","C","C","O","O","C"],"bonds":[[0,1,1],[1,2,1],[2,3,2],[2,4,1],[1,5,1]]},{"id":"beta-alanine","name":"beta-Alanine","formula":"C3H7NO2","smiles":"NCCC(O)=O","category":"amino","priority":2,"tags":["amino"],"warn":false,"inchi":"","heavy":["N","C","C","C","O","O"],"bonds":[[0,1,1],[1,2,1],[2,3,1],[3,4,2],[3,5,1]]},{"id":"valine","name":"Valine","formula":"C5H11NO2","smiles":"CC(C)C(N)C(O)=O","category":"amino","priority":3,"tags":["amino","biomolecule"],"warn":false,"inchi":"","heavy":["N","C","C","O","O","C","C","C"],"bonds":[[0,1,1],[1,2,1],[2,3,2],[2,4,1],[1,5,1],[5,6,1],[5,7,1]]},{"id":"leucine","name":"Leucine","formula":"C6H13NO2","smiles":"CC(C)CC(N)C(O)=O","category":"amino","priority":3,"tags":["amino","biomolecule"],"warn":false,"inchi":"","heavy":["N","C","C","O","O","C","C","C","C"],"bonds":[[0,1,1],[1,2,1],[2,3,2],[2,4,1],[1,5,1],[5,6,1],[6,7,1],[6,8,1]]},{"id":"isoleucine","name":"Isoleucine","formula":"C6H13NO2","smiles":"CCC(C)C(N)C(O)=O","category":"amino","priority":3,"tags":["amino","biomolecule"],"warn":false,"inchi":"","heavy":["N","C","C","O","O","C","C","C","C"],"bonds":[[0,1,1],[1,2,1],[2,3,2],[2,4,1],[1,5,1],[5,6,1],[5,7,1],[7,8,1]]},{"id":"serine","name":"Serine","formula":"C3H7NO3","smiles":"NC(CO)C(O)=O","category":"amino","priority":3,"tags":["amino","biomolecule"],"warn":false,"inchi":"","heavy":["N","C","C","O","O","C","O"],"bonds":[[0,1,1],[1,2,1],[2,3,2],[2,4,1],[1,5,1],[5,6,1]]},{"id":"threonine","name":"Threonine","formula":"C4H9NO3","smiles":"CC(O)C(N)C(O)=O","category":"amino","priority":3,"tags":["amino","biomolecule"],"warn":false,"inchi":"","heavy":["N","C","C","O","O","C","C","O"],"bonds":[[0,1,1],[1,2,1],[2,3,2],[2,4,1],[1,5,1],[5,6,1],[5,7,1]]},{"id":"cysteine","name":"Cysteine","formula":"C3H7NO2S","smiles":"NC(CS)C(O)=O","category":"amino","priority":3,"tags":["amino","biomolecule"],"warn":false,"inchi":"","heavy":["N","C","C","O","O","C","S"],"bonds":[[0,1,1],[1,2,1],[2,3,2],[2,4,1],[1,5,1],[5,6,1]]},{"id":"methionine","name":"Methionine","formula":"C5H11NO2S","smiles":"CSCCC(N)C(O)=O","category":"amino","priority":3,"tags":["amino","biomolecule"],"warn":false,"inchi":"","heavy":["N","C","C","O","O","C","C","S","C"],"bonds":[[0,1,1],[1,2,1],[2,3,2],[2,4,1],[1,5,1],[5,6,1],[6,7,1],[7,8,1]]},{"id":"aspartate","name":"Aspartate","formula":"C4H7NO4","smiles":"NC(CC(O)=O)C(O)=O","category":"amino","priority":3,"tags":["amino","biomolecule"],"warn":false,"inchi":"","heavy":["N","C","C","O","O","C","C","O","O"],"bonds":[[0,1,1],[1,2,1],[2,3,2],[2,4,1],[1,5,1],[5,6,1],[6,7,2],[6,8,1]]},{"id":"glutamate","name":"Glutamate","formula":"C5H9NO4","smiles":"NC(CCC(O)=O)C(O)=O","category":"amino","priority":3,"tags":["amino","biomolecule"],"warn":false,"inchi":"","heavy":["N","C","C","O","O","C","C","C","O","O"],"bonds":[[0,1,1],[1,2,1],[2,3,2],[2,4,1],[1,5,1],[5,6,1],[6,7,1],[7,8,2],[7,9,1]]},{"id":"asparagine","name":"Asparagine","formula":"C4H8N2O3","smiles":"NC(CC(N)=O)C(O)=O","category":"amino","priority":3,"tags":["amino","biomolecule"],"warn":false,"inchi":"","heavy":["N","C","C","O","O","C","C","O","N"],"bonds":[[0,1,1],[1,2,1],[2,3,2],[2,4,1],[1,5,1],[5,6,1],[6,7,2],[6,8,1]]},{"id":"glutamine","name":"Glutamine","formula":"C5H10N2O3","smiles":"NC(CCC(N)=O)C(O)=O","category":"amino","priority":3,"tags":["amino","biomolecule"],"warn":false,"inchi":"","heavy":["N","C","C","O","O","C","C","C","O","N"],"bonds":[[0,1,1],[1,2,1],[2,3,2],[2,4,1],[1,5,1],[5,6,1],[6,7,1],[7,8,2],[7,9,1]]},{"id":"lysine","name":"Lysine","formula":"C6H14N2O2","smiles":"NCCCCC(N)C(O)=O","category":"amino","priority":3,"tags":["amino","biomolecule"],"warn":false,"inchi":"","heavy":["N","C","C","O","O","C","C","C","C","N"],"bonds":[[0,1,1],[1,2,1],[2,3,2],[2,4,1],[1,5,1],[5,6,1],[6,7,1],[7,8,1],[8,9,1]]},{"id":"proline","name":"Proline","formula":"C5H9NO2","smiles":"C1CC(NC1)C(O)=O","category":"amino","priority":3,"tags":["amino","biomolecule"],"warn":false,"inchi":"","heavy":["N","C","C","O","O","C","C","C"],"bonds":[[0,1,1],[1,2,1],[2,3,2],[2,4,1],[1,5,1],[5,6,1],[6,7,1],[7,0,1]]},{"id":"selenocysteine","name":"Selenocysteine","formula":"C3H7NO2Se","smiles":"NC(C[SeH])C(O)=O","category":"amino","priority":3,"tags":["amino","biomolecule"],"warn":false,"inchi":"","heavy":["N","C","C","O","O","C","Se"],"bonds":[[0,1,1],[1,2,1],[2,3,2],[2,4,1],[1,5,1],[5,6,1]]},{"id":"gaba","name":"GABA","formula":"C4H9NO2","smiles":"NCCCC(O)=O","category":"amino","priority":3,"tags":["amino","neuro"],"warn":false,"inchi":"","heavy":["N","C","C","C","C","O","O"],"bonds":[[0,1,1],[1,2,1],[2,3,1],[3,4,1],[4,5,2],[4,6,1]]},{"id":"diglycine","name":"Diglycine","formula":"C4H8N2O3","smiles":"SEQ:GG","category":"amino","priority":3,"tags":["amino","peptide"],"warn":false,"inchi":"","heavy":["N","C","C","O","N","C","C","O","O"],"bonds":[[0,1,1],[1,2,1],[2,3,2],[4,5,1],[5,6,1],[6,7,2],[2,4,1],[6,8,1]]},{"id":"arginine","name":"Arginine","formula":"C6H14N4O2","smiles":"NC(CCCNC(N)=N)C(O)=O","category":"amino","priority":4,"tags":["amino","biomolecule"],"warn":false,"inchi":"","heavy":["N","C","C","O","O","C","C","C","N","C","N","N"],"bonds":[[0,1,1],[1,2,1],[2,3,2],[2,4,1],[1,5,1],[5,6,1],[6,7,1],[7,8,1],[8,9,1],[9,10,2],[9,11,1]]},{"id":"histidine","name":"Histidine","formula":"C6H9N3O2","smiles":"NC(CC1=CN=CN1)C(O)=O","category":"amino","priority":4,"tags":["amino","biomolecule"],"warn":false,"inchi":"","heavy":["N","C","C","O","O","C","C","N","C","N","C"],"bonds":[[0,1,1],[1,2,1],[2,3,2],[2,4,1],[1,5,1],[5,6,1],[6,7,4],[7,8,4],[8,9,4],[9,10,4],[10,6,4]],"explicitH":[[7,1]]},{"id":"phenylalanine","name":"Phenylalanine","formula":"C9H11NO2","smiles":"NC(CC1=CC=CC=C1)C(O)=O","category":"amino","priority":4,"tags":["amino","biomolecule"],"warn":false,"inchi":"","heavy":["N","C","C","O","O","C","C","C","C","C","C","C"],"bonds":[[0,1,1],[1,2,1],[2,3,2],[2,4,1],[1,5,1],[5,6,1],[6,7,4],[7,8,4],[8,9,4],[9,10,4],[10,11,4],[11,6,4]]},{"id":"tyrosine","name":"Tyrosine","formula":"C9H11NO3","smiles":"NC(CC1=CC=C(O)C=C1)C(O)=O","category":"amino","priority":4,"tags":["amino","biomolecule"],"warn":false,"inchi":"","heavy":["N","C","C","O","O","C","C","C","C","C","C","C","O"],"bonds":[[0,1,1],[1,2,1],[2,3,2],[2,4,1],[1,5,1],[5,6,1],[6,7,4],[7,8,4],[8,9,4],[9,10,4],[10,11,4],[11,6,4],[9,12,1]]},{"id":"tryptophan","name":"Tryptophan","formula":"C11H12N2O2","smiles":"NC(CC1=CNC2=CC=CC=C12)C(O)=O","category":"amino","priority":4,"tags":["amino","biomolecule"],"warn":false,"inchi":"","heavy":["N","C","C","O","O","C","C","C","C","C","C","C","C","C","N"],"bonds":[[0,1,1],[1,2,1],[2,3,2],[2,4,1],[1,5,1],[5,12,1],[6,7,4],[7,8,4],[8,9,4],[9,10,4],[10,11,4],[11,6,4],[11,12,4],[12,13,4],[13,14,4],[14,6,4]],"explicitH":[[14,1]]},{"id":"dopa","name":"DOPA","formula":"C9H11NO4","smiles":"NC(CC1=CC(O)=C(O)C=C1)C(O)=O","category":"amino","priority":4,"tags":["amino","biomolecule"],"warn":false,"inchi":"","heavy":["N","C","C","O","O","C","C","C","C","C","C","C","O","O"],"bonds":[[0,1,1],[1,2,1],[2,3,2],[2,4,1],[1,5,1],[5,6,1],[6,7,4],[7,8,4],[8,9,4],[9,10,4],[10,11,4],[11,6,4],[9,12,1],[8,13,1]]},{"id":"pyrrolysine","name":"Pyrrolysine","formula":"C12H21N3O3","smiles":"CC1CCC(N1C(=O)CCCCC(N)C(O)=O)","category":"amino","priority":5,"tags":["amino","biomolecule"],"warn":false,"inchi":"","heavy":["N","C","C","O","O","C","C","C","C","N","C","O","N","C","C","C","C","C"],"bonds":[[0,1,1],[1,2,1],[2,3,2],[2,4,1],[1,5,1],[5,6,1],[6,7,1],[7,8,1],[8,9,1],[9,10,1],[10,11,2],[10,12,1],[12,13,1],[13,14,1],[14,15,1],[15,16,2],[16,12,1],[13,17,1]]}]
