[{"id":"ethene","name":"Ethene","formula":"C2H4","smiles":"C=C","category":"alkenes","priority":0,"tags":["gas","monomer"],"warn":false,"inchi":""},{"id":"ethyne","name":"Ethyne","formula":"C2H2","smiles":"C#C","category":"alkenes","priority":0,"tags":["gas","alkyne"],"warn":false,"inchi":""},{"id":"propene","name":"Propene","formula":"C3H6","smiles":"CC=C","category":"alkenes","priority":1,"tags":["gas","monomer"],"warn":false,"inchi":""},{"id":"1-butene","name":"1-Butene","formula":"C4H8","smiles":"CCC=C","category":"alkenes","priority":1,"tags":["monomer"],"warn":false,"inchi":""},{"id":"cis-2-butene","name":"cis-2-Butene","formula":"C4H8","smiles":"C/C=C\\C","category":"alkenes","priority":1,"tags":["stereo"],"warn":false,"inchi":"","heavy":["C","C","C","C"],"bonds":[[0,1,1],[1,2,2,"Z"],[2,3,1]]},{"id":"trans-2-butene","name":"trans-2-Butene","formula":"C4H8","smiles":"C/C=C/C","category":"alkenes","priority":1,"tags":["stereo"],"warn":false,"inchi":"","heavy":["C","C","C","C"],"bonds":[[0,1,1],[1,2,2,"E"],[2,3,1]]},{"id":"isobutene","name":"Isobutene","formula":"C4H8","smiles":"CC(=C)C","category":"alkenes","priority":1,"tags":["monomer"],"warn":false,"inchi":""},{"id":"butadiene","name":"1,3-Butadiene","formula":"C4H6","smiles":"C=CC=C","category":"alkenes","priority":1,"tags":["monomer","diene"],"warn":false,"inchi":""},{"id":"vinyl-chloride","name":"Vinyl Chloride","formula":"C2H3Cl","smiles":"C=CCl","category":"alkenes","priority":1,"tags":["monomer"],"warn":false,"inchi":""},{"id":"acrylonitrile","name":"Acrylonitrile","formula":"C3H3N","smiles":"C=CC#N","category":"alkenes","priority":1,"tags":["monomer"],"warn":false,"inchi":""},{"id":"propyne","name":"Propyne","formula":"C3H4","smiles":"CC#C","category":"alkenes","priority":1,"tags":["gas","alkyne"],"warn":false,"inchi":""},{"id":"1-butyne","name":"1-Butyne","formula":"C4H6","smiles":"CCC#C","category":"alkenes","priority":1,"tags":["alkyne"],"warn":false,"inchi":""},{"id":"2-butyne","name":"2-Butyne","formula":"C4H6","smiles":"CC#CC","category":"alkenes","priority":1,"tags":["alkyne"],"warn":false,"inchi":""},{"id":"1-pentene","name":"1-Pentene","formula":"C5H10","smiles":"CCCC=C","category":"alkenes","priority":2,"tags":["monomer"],"warn":false,"inchi":""},{"id":"cis-2-pentene","name":"cis-2-Pentene","formula":"C5H10","smiles":"CC/C=C\\C","category":"alkenes","priority":2,"tags":["stereo"],"warn":false,"inchi":"","heavy":["C","C","C","C","C"],"bonds":[[0,1,1],[1,2,2,"Z"],[2,3,1],[3,4,1]]},{"id":"trans-2-pentene","name":"trans-2-Pentene","formula":"C5H10","smiles":"CC/C=C/C","category":"alkenes","priority":2,"tags":["stereo"],"warn":false,"inchi":"","heavy":["C","C","C","C","C"],"bonds":[[0,1,1],[1,2,2,"E"],[2,3,1],[3,4,1]]},{"id":"1-hexene","name":"1-Hexene","formula":"C6H12","smiles":"CCCCC=C","category":"alkenes","priority":2,"tags":["monomer"],"warn":false,"inchi":""},{"id":"isoprene","name":"Isoprene","formula":"C5H8","smiles":"CC(=C)C=C","category":"alkenes","priority":2,"tags":["monomer","natural","diene"],"warn":false,"inchi":""},{"id":"cyclopentene","name":"Cyclopentene","formula":"C5H8","smiles":"C1CCC=C1","category":"alkenes","priority":2,"tags":["ring"],"warn":false,"inchi":"","heavy":["C","C","C","C","C"],"bonds":[[0,1,1],[1,2,1],[2,3,2],[3,4,1],[4,0,1]]},{"id":"cyclohexene","name":"Cyclohexene","formula":"C6H10","smiles":"C1CCCC=C1","category":"alkenes","priority":2,"tags":["ring"],"warn":false,"inchi":"","heavy":["C","C","C","C","C","C"],"bonds":[[0,1,1],[1,2,1],[2,3,1],[3,4,2],[4,5,1],[5,0,1]]},{"id":"cyclopentadiene","name":"Cyclopentadiene","formula":"C5H6","smiles":"C1C=CC=C1","category":"alkenes","priority":2,"tags":["ring","diene"],"warn":false,"inchi":""},{"id":"tetrafluoroethene","name":"Tetrafluoroethene","formula":"C2F4","smiles":"FC(F)=C(F)F","category":"alkenes","priority":2,"tags":["monomer"],"warn":false,"inchi":"","heavy":["C","C","F","F","F","F"],"bonds":[[0,1,2],[0,2,1],[0,3,1],[1,4,1],[1,5,1]]},{"id":"1-hexyne","name":"1-Hexyne","formula":"C6H10","smiles":"CCCCC#C","category":"alkenes","priority":2,"tags":["alkyne"],"warn":false,"inchi":""},{"id":"3-hexyne","name":"3-Hexyne","formula":"C6H10","smiles":"CCC#CCC","category":"alkenes","priority":2,"tags":["alkyne"],"warn":false,"inchi":""},{"id":"1-octene","name":"1-Octene","formula":"C8H16","smiles":"CCCCCCC=C","category":"alkenes","priority":3,"tags":["monomer"],"warn":false,"inchi":""},{"id":"1-decene","name":"1-Decene","formula":"C10H20","smiles":"CCCCCCCCC=C","category":"alkenes","priority":3,"tags":["monomer"],"warn":false,"inchi":""},{"id":"norbornene","name":"Norbornene","formula":"C7H10","smiles":"C1CC2CC1C=C2","category":"alkenes","priority":3,"tags":["ring","strained","monomer"],"warn":false,"inchi":"","heavy":["C","C","C","C","C","C","C"],"bonds":[[0,1,1],[1,2,1],[2,3,1],[3,4,2],[4,5,1],[5,0,1],[1,6,1],[5,6,1]]},{"id":"styrene","name":"Styrene","formula":"C8H8","smiles":"C=CCC1=CC=CC=C1","category":"alkenes","priority":3,"tags":["monomer","aromatic"],"warn":false,"inchi":"","heavy":["C","C","C","C","C","C","C","C"],"bonds":[[0,1,2],[1,2,1],[2,3,4],[3,4,4],[4,5,4],[5,6,4],[6,7,4],[7,2,4]]},{"id":"methyl-methacrylate","name":"Methyl Methacrylate","formula":"C5H8O2","smiles":"CC(=C)C(=O)OC","category":"alkenes","priority":3,"tags":["monomer"],"warn":false,"inchi":""},{"id":"phenylacetylene","name":"Phenylacetylene","formula":"C8H6","smiles":"C#CC1=CC=CC=C1","category":"alkenes","priority":3,"tags":["alkyne","aromatic"],"warn":false,"inchi":"","heavy":["C","C","C","C","C","C","C","C"],"bonds":[[0,1,3],[1,2,1],[2,3,4],[3,4,4],[4,5,4],[5,6,4],[6,7,4],[7,2,4]]}]
