[{"id":"alkane-c1","name":"Methane","formula":"CH4","smiles":"C","category":"alkanes","priority":0,"tags":["gas","fuel"],"warn":false,"inchi":""},{"id":"alkane-c2","name":"Ethane","formula":"C2H6","smiles":"CC","category":"alkanes","priority":0,"tags":["gas","fuel"],"warn":false,"inchi":""},{"id":"alkane-c3","name":"Propane","formula":"C3H8","smiles":"CCC","category":"alkanes","priority":1,"tags":["gas","fuel"],"warn":false,"inchi":""},{"id":"alkane-c4","name":"Butane","formula":"C4H10","smiles":"CCCC","category":"alkanes","priority":1,"tags":["gas","fuel"],"warn":false,"inchi":""},{"id":"isobutane","name":"Isobutane","formula":"C4H10","smiles":"CC(C)C","category":"alkanes","priority":1,"tags":["fuel","branched"],"warn":false,"inchi":"","heavy":["C","C","C","C"],"bonds":[[0,1,1],[0,2,1],[0,3,1]]},{"id":"cyclopropane","name":"Cyclopropane","formula":"C3H6","smiles":"C1CC1","category":"alkanes","priority":1,"tags":["ring","strained"],"warn":false,"inchi":""},{"id":"cyclobutane","name":"Cyclobutane","formula":"C4H8","smiles":"C1CCC1","category":"alkanes","priority":1,"tags":["ring","strained"],"warn":false,"inchi":""},{"id":"alkane-c5","name":"Pentane","formula":"C5H12","smiles":"CCCCC","category":"alkanes","priority":2,"tags":["fuel","hydrocarbon"],"warn":false,"inchi":""},{"id":"alkane-c6","name":"Hexane","formula":"C6H14","smiles":"CCCCCC","category":"alkanes","priority":2,"tags":["fuel","hydrocarbon"],"warn":false,"inchi":""},{"id":"isopentane","name":"Isopentane","formula":"C5H12","smiles":"CCC(C)C","category":"alkanes","priority":2,"tags":["fuel","branched"],"warn":false,"inchi":""},{"id":"neopentane","name":"Neopentane","formula":"C5H12","smiles":"CC(C)(C)C","category":"alkanes","priority":2,"tags":["fuel","branched"],"warn":false,"inchi":"","heavy":["C","C","C","C","C"],"bonds":[[0,1,1],[0,2,1],[0,3,1],[0,4,1]]},{"id":"2-methylpentane","name":"2-Methylpentane","formula":"C6H14","smiles":"CCCC(C)C","category":"alkanes","priority":2,"tags":["fuel","branched"],"warn":false,"inchi":""},{"id":"3-methylpentane","name":"3-Methylpentane","formula":"C6H14","smiles":"CCC(C)CC","category":"alkanes","priority":2,"tags":["fuel","branched"],"warn":false,"inchi":"","heavy":["C","C","C","C","C","C"],"bonds":[[0,1,1],[1,2,1],[2,3,1],[2,4,1],[3,5,1]]},{"id":"2-2-dimethylbutane","name":"2,2-Dimethylbutane","formula":"C6H14","smiles":"CCC(C)(C)C","category":"alkanes","priority":2,"tags":["fuel","branched"],"warn":false,"inchi":"","heavy":["C","C","C","C","C","C"],"bonds":[[0,1,1],[1,2,1],[1,3,1],[1,4,1],[2,5,1]]},{"id":"2-3-dimethylbutane","name":"2,3-Dimethylbutane","formula":"C6H14","smiles":"CC(C)C(C)C","category":"alkanes","priority":2,"tags":["fuel","branched"],"warn":false,"inchi":"","heavy":["C","C","C","C","C","C"],"bonds":[[0,1,1],[1,2,1],[2,3,1],[1,4,1],[2,5,1]]},{"id":"cyclopentane","name":"Cyclopentane","formula":"C5H10","smiles":"C1CCCC1","category":"alkanes","priority":2,"tags":["ring"],"warn":false,"inchi":""},{"id":"cyclohexane","name":"Cyclohexane","formula":"C6H12","smiles":"C1CCCCC1","category":"alkanes","priority":2,"tags":["ring","solvent"],"warn":false,"inchi":""},{"id":"alkane-c7","name":"Heptane","formula":"C7H16","smiles":"CCCCCCC","category":"alkanes","priority":3,"tags":["fuel","hydrocarbon"],"warn":false,"inchi":""},{"id":"alkane-c8","name":"Octane","formula":"C8H18","smiles":"CCCCCCCC","category":"alkanes","priority":3,"tags":["fuel","hydrocarbon"],"warn":false,"inchi":""},{"id":"alkane-c9","name":"Nonane","formula":"C9H20","smiles":"CCCCCCCCC","category":"alkanes","priority":3,"tags":["fuel","hydrocarbon"],"warn":false,"inchi":""},{"id":"alkane-c10","name":"Decane","formula":"C10H22","smiles":"CCCCCCCCCC","category":"alkanes","priority":3,"tags":["fuel","hydrocarbon"],"warn":false,"inchi":""},{"id":"isooctane","name":"Isooctane","formula":"C8H18","smiles":"CC(C)CC(C)(C)C","category":"alkanes","priority":3,"tags":["fuel","branched"],"warn":false,"inchi":"","heavy":["C","C","C","C","C","C","C","C"],"bonds":[[0,1,1],[1,2,1],[2,3,1],[3,4,1],[1,5,1],[3,6,1],[3,7,1]]},{"id":"cyclooctane","name":"Cyclooctane","formula":"C8H16","smiles":"C1CCCCCCC1","category":"alkanes","priority":3,"tags":["ring"],"warn":false,"inchi":""},{"id":"cubane","name":"Cubane","formula":"C8H8","smiles":"C12C3C4C1C5C4C3C25","category":"alkanes","priority":3,"tags":["strained","cage"],"warn":false,"inchi":"","heavy":["C","C","C","C","C","C","C","C"],"bonds":[[0,1,1],[1,2,1],[2,3,1],[3,0,1],[4,5,1],[5,6,1],[6,7,1],[7,4,1],[0,4,1],[1,5,1],[2,6,1],[3,7,1]]},{"id":"adamantane","name":"Adamantane","formula":"C10H16","smiles":"C1C2CC3CC1CC(C2)C3","category":"alkanes","priority":3,"tags":["cage","diamondoid"],"warn":false,"inchi":"","heavy":["C","C","C","C","C","C","C","C","C","C"],"bonds":[[0,4,1],[0,5,1],[0,6,1],[1,4,1],[1,7,1],[1,8,1],[2,5,1],[2,7,1],[2,9,1],[3,6,1],[3,8,1],[3,9,1]]},{"id":"alkane-c11","name":"Undecane","formula":"C11H24","smiles":"CCCCCCCCCCC","category":"alkanes","priority":4,"tags":["fuel","hydrocarbon"],"warn":false,"inchi":""},{"id":"alkane-c12","name":"Dodecane","formula":"C12H26","smiles":"CCCCCCCCCCCC","category":"alkanes","priority":4,"tags":["fuel","hydrocarbon"],"warn":false,"inchi":""},{"id":"alkane-c13","name":"Tridecane","formula":"C13H28","smiles":"CCCCCCCCCCCCC","category":"alkanes","priority":4,"tags":["fuel","hydrocarbon"],"warn":false,"inchi":""},{"id":"alkane-c14","name":"Tetradecane","formula":"C14H30","smiles":"CCCCCCCCCCCCCC","category":"alkanes","priority":4,"tags":["fuel","hydrocarbon"],"warn":false,"inchi":""},{"id":"alkane-c15","name":"Pentadecane","formula":"C15H32","smiles":"CCCCCCCCCCCCCCC","category":"alkanes","priority":4,"tags":["fuel","hydrocarbon"],"warn":false,"inchi":""},{"id":"alkane-c16","name":"Hexadecane","formula":"C16H34","smiles":"CCCCCCCCCCCCCCCC","category":"alkanes","priority":4,"tags":["fuel","hydrocarbon"],"warn":false,"inchi":""},{"id":"alkane-c17","name":"Heptadecane","formula":"C17H36","smiles":"CCCCCCCCCCCCCCCCC","category":"alkanes","priority":5,"tags":["fuel","hydrocarbon"],"warn":false,"inchi":""},{"id":"alkane-c18","name":"Octadecane","formula":"C18H38","smiles":"CCCCCCCCCCCCCCCCCC","category":"alkanes","priority":5,"tags":["fuel","hydrocarbon"],"warn":false,"inchi":""},{"id":"alkane-c19","name":"Nonadecane","formula":"C19H40","smiles":"CCCCCCCCCCCCCCCCCCC","category":"alkanes","priority":5,"tags":["fuel","hydrocarbon"],"warn":false,"inchi":""},{"id":"alkane-c20","name":"Icosane","formula":"C20H42","smiles":"CCCCCCCCCCCCCCCCCCCC","category":"alkanes","priority":5,"tags":["fuel","hydrocarbon"],"warn":false,"inchi":""}]
