[{"id":"hcn","name":"Hydrogen Cyanide","formula":"CHN","smiles":"C#N","category":"toxins","priority":0,"tags":["toxin","gas"],"warn":true,"inchi":""},{"id":"carbon-monoxide","name":"Carbon Monoxide","formula":"CO","smiles":"[C-]#[O+]","category":"toxins","priority":0,"tags":["toxin","gas"],"warn":true,"inchi":"","heavy":["C","O"],"bonds":[[0,1,3]],"charges":[[0,-1],[1,1]],"explicitH":[[0,0]]},{"id":"cyanogen-chloride","name":"Cyanogen Chloride","formula":"CNCl","smiles":"ClC#N","category":"toxins","priority":1,"tags":["toxin","gas"],"warn":true,"inchi":"","heavy":["C","N","Cl"],"bonds":[[0,1,3],[0,2,1]]},{"id":"phosgene","name":"Phosgene","formula":"CCl2O","smiles":"O=C(Cl)Cl","category":"toxins","priority":1,"tags":["toxin","gas"],"warn":true,"inchi":"","heavy":["C","O","Cl","Cl"],"bonds":[[0,1,2],[0,2,1],[0,3,1]]},{"id":"lewisite","name":"Lewisite","formula":"C2H2AsCl3","smiles":"Cl/C=C/As(Cl)Cl","category":"toxins","priority":2,"tags":["toxin"],"warn":true,"inchi":"","heavy":["Cl","C","C","As","Cl","Cl"],"bonds":[[0,1,1],[1,2,2,"E"],[2,3,1],[3,4,1],[3,5,1]]},{"id":"sarin","name":"Sarin","formula":"C4H10FO2P","smiles":"CC(C)OP(=O)(C)F","category":"toxins","priority":3,"tags":["toxin"],"warn":true,"inchi":"","heavy":["C","P","O","F","O","C","C","C"],"bonds":[[0,1,1],[1,2,2],[1,3,1],[1,4,1],[4,5,1],[5,6,1],[5,7,1]]},{"id":"tabun","name":"Tabun","formula":"C5H11N2O2P","smiles":"CCOP(=O)(N(C)C)C#N","category":"toxins","priority":3,"tags":["toxin"],"warn":true,"inchi":"","heavy":["C","C","N","P","O","C","O","C","C","N"],"bonds":[[0,2,1],[1,2,1],[2,3,1],[3,4,2],[3,5,1],[5,9,3],[3,6,1],[6,7,1],[7,8,1]]},{"id":"mustard-gas","name":"Mustard Gas","formula":"C4H8Cl2S","smiles":"ClCCSCCCl","category":"toxins","priority":3,"tags":["toxin"],"warn":true,"inchi":""},{"id":"vx","name":"VX","formula":"C11H26NO2PS","smiles":"CCOP(=O)(C)SCCN(C(C)C)C(C)C","category":"toxins","priority":4,"tags":["toxin"],"warn":true,"inchi":"","heavy":["C","P","O","S","C","C","N","C","C","C","C","C","C","O","C","C"],"bonds":[[0,1,1],[1,2,2],[1,3,1],[1,13,1],[3,4,1],[4,5,1],[5,6,1],[6,7,1],[7,8,1],[7,9,1],[6,10,1],[10,11,1],[10,12,1],[13,14,1],[14,15,1]]},{"id":"soman","name":"Soman","formula":"C7H16FO2P","smiles":"CC(C)(C)C(C)OP(=O)(C)F","category":"toxins","priority":4,"tags":["toxin"],"warn":true,"inchi":"","heavy":["C","P","O","F","O","C","C","C","C","C","C"],"bonds":[[0,1,1],[1,2,2],[1,3,1],[1,4,1],[4,5,1],[5,6,1],[5,7,1],[7,8,1],[7,9,1],[7,10,1]]},{"id":"ricin-fragment","name":"Ricin A-Chain Fragment","formula":"C31H48N10O10","smiles":"SEQ:EAARFQ","category":"toxins","priority":7,"tags":["toxin","peptide"],"warn":true,"inchi":"","heavy":["N","C","C","O","C","C","C","O","O","N","C","C","O","C","N","C","C","O","C","N","C","C","O","C","C","C","N","C","N","N","N","C","C","O","C","C","C","C","C","C","C","N","C","C","O","O","C","C","C","O","N"],"bonds":[[0,1,1],[1,2,1],[2,3,2],[1,4,1],[4,5,1],[5,6,1],[6,7,2],[6,8,1],[9,10,1],[10,11,1],[11,12,2],[2,9,1],[10,13,1],[14,15,1],[15,16,1],[16,17,2],[11,14,1],[15,18,1],[19,20,1],[20,21,1],[21,22,2],[16,19,1],[20,23,1],[23,24,1],[24,25,1],[25,26,1],[26,27,1],[27,28,2],[27,29,1],[30,31,1],[31,32,1],[32,33,2],[21,30,1],[31,34,1],[34,35,1],[35,36,4],[36,37,4],[37,38,4],[38,39,4],[39,40,4],[40,35,4],[41,42,1],[42,43,1],[43,44,2],[32,41,1],[43,45,1],[42,46,1],[46,47,1],[47,48,1],[48,49,2],[48,50,1]]},{"id":"botulinum-fragment","name":"Botulinum Fragment","formula":"C29H45N9O8","smiles":"SEQ:HELIH","category":"toxins","priority":7,"tags":["toxin","peptide"],"warn":true,"inchi":"","heavy":["N","C","C","O","C","C","N","C","N","C","N","C","C","O","C","C","C","O","O","N","C","C","O","C","C","C","C","N","C","C","O","C","C","C","C","N","C","C","O","O","C","C","N","C","N","C"],"bonds":[[0,1,1],[1,2,1],[2,3,2],[1,4,1],[4,5,1],[5,6,4],[6,7,4],[7,8,4],[8,9,4],[9,5,4],[10,11,1],[11,12,1],[12,13,2],[2,10,1],[11,14,1],[14,15,1],[15,16,1],[16,17,2],[16,18,1],[19,20,1],[20,21,1],[21,22,2],[12,19,1],[20,23,1],[23,24,1],[24,25,1],[24,26,1],[27,28,1],[28,29,1],[29,30,2],[21,27,1],[28,31,1],[31,32,1],[31,33,1],[33,34,1],[35,36,1],[36,37,1],[37,38,2],[29,35,1],[37,39,1],[36,40,1],[40,41,1],[41,42,4],[42,43,4],[43,44,4],[44,45,4],[45,41,4]],"explicitH":[[6,1],[42,1]]}]
